{
  "schema_version": 1,
  "updated_at": "2026-09-25",
  "purpose": "Sanitized relationship reconciliation and source-attribution policy. Only durable user-approved relationship names belong here; unresolved third-party identities, raw messages, contact data, and uncertain identity evidence remain local/private.",
  "durable_relationship_context": {
    "partner": {
      "person_id": "person:olivia",
      "display_name": "Olivia",
      "identity_confidence": "stated",
      "relationship_type": "romantic_partner",
      "relationship_confidence": "stated",
      "current_label": "girlfriend",
      "household_planning": true,
      "historical_labels": [
        {
          "label": "fiancée",
          "observed": "2025-09",
          "status": "historical_only"
        }
      ],
      "rule": "Newest direct user wording controls the current relationship label; household evidence does not establish Olivia's individual preferences.",
      "first_seen": "2023",
      "last_seen": "2026-09-25"
    },
    "family": {
      "sibling_structure": "User is the oldest of five siblings.",
      "confidence": "stated",
      "privacy_class": "restricted_detail",
      "rule": "Keep individual sibling identities and private family dynamics local unless a task explicitly requires them."
    }
  },
  "source_attribution_policy": {
    "account_owner_not_equal_actor": true,
    "allowed_actor_states": [
      "user",
      "user_confirmed",
      "other_account_user",
      "third_party",
      "organization_archive",
      "automated",
      "unknown"
    ],
    "profile_promotion_default": "Direct personal-profile promotion requires both user/user_confirmed authorship and user/user_confirmed subject attribution, unless the user explicitly confirms the candidate.",
    "mixed_archive_rule": "Organizational mail/PST archives must resolve message actor and subject before creating personal-profile candidates.",
    "same_name_rule": "Name equality alone never merges people.",
    "allowed_subject_states": [
      "user",
      "user_confirmed",
      "third_party",
      "organization",
      "mixed",
      "unknown"
    ],
    "subject_not_equal_actor": "Authorship and subject identity are separate. A user-authored message about an applicant, coworker, family member, or organization is not autobiographical evidence."
  },
  "quarantined_or_unresolved": [
    {
      "id": "claim:regent-it-biography",
      "status": "quarantined",
      "reason": "Conflicts with stronger/current biography and is plausibly attributable to another user of the shared ChatGPT account.",
      "promotion_rule": "Requires independent user confirmation."
    },
    {
      "id": "claim:audio-engineering-masters",
      "status": "quarantined",
      "reason": "Single historical account-authored claim with unresolved actor attribution and no corroborated completion/current enrollment.",
      "promotion_rule": "Requires actor attribution or newer direct user confirmation."
    }
  ],
  "unresolved_identity_candidates": [
    {
      "id": "candidate:social-contact-01",
      "label": "Named social-contact candidate",
      "domain": "personal",
      "status": "candidate",
      "reason": "A recurring imported social identity exists, but closeness/current relationship and safe canonical relevance are unresolved. Keep the actual identity local."
    },
    {
      "id": "candidate:recurring-friend-01",
      "label": "Unidentified recurring friend candidate",
      "domain": "personal",
      "status": "candidate",
      "reason": "Recurring friend/photo context exists without a reliable identity. Keep any source-level identifying details local."
    },
    {
      "id": "candidate:work-same-name-collision-01",
      "label": "Workplace same-name collision candidate",
      "domain": "work",
      "status": "candidate",
      "reason": "A workplace identity shares a name with a durable personal relationship. Do not merge by name; keep the work identity local until independently resolved."
    },
    {
      "id": "candidate:work-contact-cross-context-01",
      "label": "Cross-context work-contact candidate",
      "domain": "work",
      "status": "candidate_same_person_link",
      "reason": "A named work contact appears across multiple work contexts; organization/time evidence must establish continuity. Keep the name and raw evidence local."
    },
    {
      "id": "candidate:work-first-name-collision-01",
      "label": "Historical/current work-name collision candidate",
      "domain": "work",
      "status": "candidate_collision",
      "reason": "Current work and historical organizational-archive references may refer to different people. Keep source identities local and require temporal/organization evidence."
    }
  ],
  "provenance": [
    {
      "source": "cross_source_reconciliation_2026-09-25",
      "status": "derived_context",
      "note": "Built from previously ingested personal mail/profile/conversation evidence; uncertain third-party links remain non-canonical candidates."
    }
  ]
}
